{
  "schemaVersion": "0.1.0",
  "artifactType": "artifact_compatibility_matrix",
  "matrixVersion": "1.0.0",
  "semverPolicy": {
    "patch": "backward-compatible fixes only",
    "minor": "additive fields require migration or diagnostic downgrade",
    "major": "breaking and never auto-migrated",
    "zeroMajor": "0.y.z minor changes are treated as breaking"
  },
  "policies": [
    {
      "artifactType": "contract_model",
      "currentVersion": "0.1.0",
      "readableVersions": ["0.1.x"],
      "migrationMode": "identity",
      "requiredTrustFields": ["contractHash", "evidenceRefs"],
      "missingTrustDisposition": "DIAGNOSTIC_ONLY",
      "unsupportedCode": "ARTIFACT_SCHEMA_VERSION_UNSUPPORTED",
      "action": "Regenerate the ContractModel with a compatible AWB version before using it for comparison or gating."
    },
    {
      "artifactType": "profile_evidence",
      "currentVersion": "0.1.0",
      "readableVersions": ["0.1.x"],
      "migrationMode": "add_metadata",
      "inferUnversionedAs": "0.1.0",
      "requiredTrustFields": ["targetId", "root", "scannedFiles"],
      "missingTrustDisposition": "DIAGNOSTIC_ONLY",
      "unsupportedCode": "ARTIFACT_SCHEMA_VERSION_UNSUPPORTED",
      "action": "Regenerate public profile evidence with a compatible AWB version."
    },
    {
      "artifactType": "generation_manifest",
      "currentVersion": "0.1.0",
      "readableVersions": ["0.1.x"],
      "migrationMode": "add_metadata",
      "requiredTrustFields": ["contractHash", "caseIds", "seed"],
      "missingTrustDisposition": "DIAGNOSTIC_ONLY",
      "unsupportedCode": "ARTIFACT_SCHEMA_VERSION_UNSUPPORTED",
      "action": "Rematerialize the case suite with a compatible AWB version."
    },
    {
      "artifactType": "runtime_manifest",
      "currentVersion": "0.1.0",
      "readableVersions": ["0.1.x"],
      "migrationMode": "add_metadata",
      "inferUnversionedAs": "0.1.0",
      "requiredTrustFields": ["attemptId", "runner.capabilitiesHash", "contractHash", "seed"],
      "missingTrustDisposition": "DIAGNOSTIC_ONLY",
      "unsupportedCode": "ARTIFACT_SCHEMA_VERSION_UNSUPPORTED",
      "action": "Rerun the workflow with a compatible AWB version to regenerate execution identity."
    },
    {
      "artifactType": "observer-qualification",
      "currentVersion": "0.1.0",
      "readableVersions": ["0.1.x"],
      "migrationMode": "diagnostic_on_missing_trust",
      "requiredTrustFields": ["subject.contractHash", "subject.caseSetHash", "integrity.contentHash", "attestation.signature", "attestation.authorityFingerprint"],
      "missingTrustDisposition": "DIAGNOSTIC_ONLY",
      "unsupportedCode": "ARTIFACT_SCHEMA_VERSION_UNSUPPORTED",
      "action": "Requalify the Observer with a separate trusted authority; missing attestation cannot be reconstructed."
    },
    {
      "artifactType": "reliability_report",
      "currentVersion": "0.1.0",
      "readableVersions": ["0.1.x"],
      "migrationMode": "diagnostic_on_missing_trust",
      "requiredTrustFields": ["integrity.contentHash", "gateEligibility"],
      "missingTrustDisposition": "DIAGNOSTIC_ONLY",
      "unsupportedCode": "ARTIFACT_SCHEMA_VERSION_UNSUPPORTED",
      "action": "Rerun the reliability study from provenance-validated samples."
    },
    {
      "artifactType": "external_validity_report",
      "currentVersion": "0.1.0",
      "readableVersions": ["0.1.x"],
      "migrationMode": "diagnostic_on_missing_trust",
      "requiredTrustFields": ["integrity.contentHash", "bindings.policyHash", "bindings.verifiedEvidenceHash", "gateEligibility"],
      "missingTrustDisposition": "DIAGNOSTIC_ONLY",
      "unsupportedCode": "ARTIFACT_SCHEMA_VERSION_UNSUPPORTED",
      "action": "Reanalyze the blinded external-validity package with verified evidence and human labels."
    },
    {
      "artifactType": "suite",
      "currentVersion": "0.1.0",
      "readableVersions": ["0.1.x"],
      "migrationMode": "diagnostic_on_missing_trust",
      "requiredTrustFields": ["gatePolicy.policyHash", "gatePolicy.rulesHash", "releaseDecision"],
      "missingTrustDisposition": "DIAGNOSTIC_ONLY",
      "unsupportedCode": "ARTIFACT_SCHEMA_VERSION_UNSUPPORTED",
      "action": "Recompute the suite under an explicit gate policy; legacy unbound scores remain diagnostic-only."
    },
    {
      "artifactType": "comparison_result",
      "currentVersion": "0.1.0",
      "readableVersions": ["0.1.x"],
      "migrationMode": "diagnostic_on_missing_trust",
      "requiredTrustFields": ["gatePolicy.policyHash", "integrity.comparisonHash"],
      "missingTrustDisposition": "DIAGNOSTIC_ONLY",
      "unsupportedCode": "ARTIFACT_SCHEMA_VERSION_UNSUPPORTED",
      "action": "Recompute the comparison from validated baseline and candidate bundles under the selected gate policy."
    },
    {
      "artifactType": "gate_result",
      "currentVersion": "0.1.0",
      "readableVersions": ["0.1.x"],
      "migrationMode": "diagnostic_on_missing_trust",
      "requiredTrustFields": ["gatePolicy.policyHash", "comparisonIntegrity"],
      "missingTrustDisposition": "DIAGNOSTIC_ONLY",
      "unsupportedCode": "ARTIFACT_SCHEMA_VERSION_UNSUPPORTED",
      "action": "Re-evaluate the gate from a verified comparison and explicit policy."
    },
    {
      "artifactType": "provenance",
      "currentVersion": "0.1.0",
      "readableVersions": ["0.1.x"],
      "migrationMode": "diagnostic_on_missing_trust",
      "requiredTrustFields": ["integrity.status", "integrity.artifacts", "conditions.conditionsHash"],
      "missingTrustDisposition": "DIAGNOSTIC_ONLY",
      "unsupportedCode": "ARTIFACT_SCHEMA_VERSION_UNSUPPORTED",
      "action": "Regenerate provenance from the original run artifacts; trust fields cannot be inferred."
    },
    {
      "artifactType": "production_isolation_manifest",
      "currentVersion": "0.1.0",
      "readableVersions": ["0.1.x"],
      "migrationMode": "diagnostic_on_missing_trust",
      "requiredTrustFields": ["checks.privateKeyUnreadableByRunner", "trustAnchor.source", "retentionPolicy.redactedOnly"],
      "missingTrustDisposition": "DIAGNOSTIC_ONLY",
      "unsupportedCode": "ARTIFACT_SCHEMA_VERSION_UNSUPPORTED",
      "action": "Regenerate isolation evidence from a strong container or equivalent sandbox boundary."
    },
    {
      "artifactType": "production_canary_report",
      "currentVersion": "0.1.0",
      "readableVersions": ["0.1.x"],
      "migrationMode": "diagnostic_on_missing_trust",
      "requiredTrustFields": ["policyHash", "sampleSetHash", "isolationManifestHash", "gatePolicyHash", "sampleCount", "expectedPassCount", "expectedBlockCount"],
      "missingTrustDisposition": "DIAGNOSTIC_ONLY",
      "unsupportedCode": "ARTIFACT_SCHEMA_VERSION_UNSUPPORTED",
      "action": "Rerun the observe-only canary under the current frozen production readiness policy."
    },
    {
      "artifactType": "production_blocking_authorization",
      "currentVersion": "0.1.0",
      "readableVersions": ["0.1.x"],
      "migrationMode": "diagnostic_on_missing_trust",
      "requiredTrustFields": ["attestation.signature", "canaryReportHash", "isolationManifestHash", "gateResultHash", "runtimeManifestHash", "provenanceHash", "gatePolicyHash"],
      "missingTrustDisposition": "DIAGNOSTIC_ONLY",
      "unsupportedCode": "ARTIFACT_SCHEMA_VERSION_UNSUPPORTED",
      "action": "Obtain a current authorization signed by the external production change-control authority."
    },
    {
      "artifactType": "production_ci_gate_result",
      "currentVersion": "0.1.0",
      "readableVersions": ["0.1.x"],
      "migrationMode": "diagnostic_on_missing_trust",
      "requiredTrustFields": ["bindings.gatePolicyHash", "bindings.gateResultHash", "bindings.runtimeManifestHash", "bindings.provenanceHash", "bindings.isolationManifestHash", "bindings.canaryReportHash", "productionBlockingEnabled"],
      "missingTrustDisposition": "DIAGNOSTIC_ONLY",
      "unsupportedCode": "ARTIFACT_SCHEMA_VERSION_UNSUPPORTED",
      "action": "Reassess production readiness from verified gate, isolation, canary, and authorization evidence."
    },
    {
      "artifactType": "decision_report",
      "currentVersion": "0.1.0",
      "readableVersions": ["0.1.x"],
      "migrationMode": "diagnostic_on_missing_trust",
      "requiredTrustFields": ["integrity.contentHash", "gatePolicyHash", "provenance.comparisonHash", "provenance.gateResultHash", "provenance.gatePolicyHash", "provenance.sourceArtifacts", "gateDecision", "releaseAuthority"],
      "missingTrustDisposition": "DIAGNOSTIC_ONLY",
      "unsupportedCode": "ARTIFACT_SCHEMA_VERSION_UNSUPPORTED",
      "action": "Regenerate the decision report from verified comparison, gate, provenance, and owner-review evidence."
    },
    {
      "artifactType": "trace_diff",
      "currentVersion": "0.1.0",
      "readableVersions": ["0.1.x"],
      "migrationMode": "diagnostic_on_missing_trust",
      "requiredTrustFields": ["integrity.contentHash", "integrity.sourceTraceHashes", "evidenceLevel", "verification.status", "verification.sourceTraceHashes", "sources.baseline.traceHash", "baselineTraceHash", "caseDiffs"],
      "missingTrustDisposition": "DIAGNOSTIC_ONLY",
      "unsupportedCode": "ARTIFACT_SCHEMA_VERSION_UNSUPPORTED",
      "action": "Regenerate the trace diff from verified source trace bundles; raw event payloads are not accepted as portable diff evidence."
    },
    {
      "artifactType": "trend_report",
      "currentVersion": "0.1.0",
      "readableVersions": ["0.1.x"],
      "migrationMode": "diagnostic_on_missing_trust",
      "requiredTrustFields": ["integrity.contentHash", "inputHash", "points", "segments", "chartSeries", "manifest.inputHash"],
      "missingTrustDisposition": "DIAGNOSTIC_ONLY",
      "unsupportedCode": "ARTIFACT_SCHEMA_VERSION_UNSUPPORTED",
      "action": "Rebuild the trend from comparable comparison points; split or downgrade segments when comparability fingerprints diverge."
    },